{
  "artifact_sha256": "3333333333333333333333333333333333333333333333333333333333333333",
  "build_commit": "0000000000000000000000000000000000000000",
  "config_bundle_sha256": "2222222222222222222222222222222222222222222222222222222222222222",
  "contract_manifest_sha256": "1111111111111111111111111111111111111111111111111111111111111111",
  "emitted_at_us": 1786156800123456,
  "event_id": "evt_triad_forecast_response_v2",
  "event_kind": "FORECAST_RESPONSE",
  "payload": {
    "artifact_version": "x",
    "calibration": {},
    "citations": [],
    "decision_authority": "NONE",
    "freshness": {},
    "model_version": "x",
    "prompt_version": "x",
    "retrieval_version": "x",
    "uncertainty": {}
  },
  "producer_instance_id": "inst_golden_01",
  "producer_service": "triad-e03",
  "schema": "triad.forecast_response.v2",
  "schema_version": "2.0.0"
}
